Hirsch, A. L.; Wilhelm, M.; Davin, E. L.; Thiery, W.; Seneviratne, S. I.;;;;;;;;;;;;;;;;;;;;;;;;;;;;;;;;;;;;;;;;;;;;;;;;;;;;;;;;;;;;;;;;;;;;;;;;;;;;;;;;;;;;;;;;;;;;;;;;;;;;;;;;;;;;;;;;;;;;;;;;;;;;
Duan, Hongbo;;;;;;;;;;;;;;;;;;;;;;;;;;;;;;;;;;;;;;;;;;;;;;;;;;;;;;;;;;;;;;;;;;;;;;;;;;;;;;;;;;;;;;;;;;;;;;;;;;;;;;;;;;;;;;;;;;;;;;;;;;;;;;;;
Siler, Nicholas; Proistosescu, Cristian; Po-Chedley, Stephen;;;;;;;;;;;;;;;;;;;;;;;;;;;;;;;;;;;;;;;;;;;;;;;;;;;;;;;;;;;;;;;;;;;;;;;;;;;;;;;;;;;;;;;;;;;;;;;;;;;;;;;;;;;;;;;;;;;;;;;;;;;;;;
Dinde, Amruta R.; Jagtap, Satyawan R.;;;;;;;;;;;;;;;;;;;;;;;;;;;;;;;;;;;;;;;;;;;;;;;;;;;;;;;;;;;;;;;;;;;;;;;;;;;;;;;;;;;;;;;;;;;;;;;;;;;;;;;;;;;;;;;;;;;;;;;;;;;;;;;
Kondo, Rena; Kinoshita, Yuki; Yamada, Tetsuo; Itsubo, Norihiro; Inoue, Masato;;;;;;;;;;;;;;;;;;;;;;;;;;;;;;;;;;;;;;;;;;;;;;;;;;;;;;;;;;;;;;;;;;;;;;;;;;;;;;;;;;;;;;;;;;;;;;;;;;;;;;;;;;;;;;;;;;;;;;;;;;;;
Gerber, Edwin P.; DallaSanta, Kevin; Gupta, Aman;;;;;;;;;;;;;;;;;;;;;;;;;;;;;;;;;;;;;;;;;;;;;;;;;;;;;;;;;;;;;;;;;;;;;;;;;;;;;;;;;;;;;;;;;;;;;;;;;;;;;;;;;;;;;;;;;;;;;;;;;;;;;;
Feron, S.; Cordero, R. R.; Damiani, A.; Llanillo, P. J.; Jorquera, J.; Sepulveda, E.; Asencio, V.; Laroze, D.; Labbe, F.; Carrasco, J.; Torres, G.;;;;;;;;;;;;;;;;;;;;;;;;;;;;;;;;;;;;;;;;;;;;;;;;;;;;;;;;;;;;;;;;;;;;;;;;;;;;;;;;;;;;;;;;;;;;;;;;;;;;;;;;;;;;;;;;;;;;;;
Alatalo, Juha M.; Little, Chelsea J.; Jagerbrand, Annika K.; Molau, Ulf;;;;;;;;;;;;;;;;;;;;;;;;;;;;;;;;;;;;;;;;;;;;;;;;;;;;;;;;;;;;;;;;;;;;;;;;;;;;;;;;;;;;;;;;;;;;;;;;;;;;;;;;;;;;;;;;;;;;;;;;;;;;;
Chung, Christine T. Y.; Power, Scott B.;;;;;;;;;;;;;;;;;;;;;;;;;;;;;;;;;;;;;;;;;;;;;;;;;;;;;;;;;;;;;;;;;;;;;;;;;;;;;;;;;;;;;;;;;;;;;;;;;;;;;;;;;;;;;;;;;;;;;;;;;;;;;;;
Ortega, Zaida; Mencia, Abraham; Perez-Mellado, Valentin;;;;;;;;;;;;;;;;;;;;;;;;;;;;;;;;;;;;;;;;;;;;;;;;;;;;;;;;;;;;;;;;;;;;;;;;;;;;;;;;;;;;;;;;;;;;;;;;;;;;;;;;;;;;;;;;;;;;;;;;;;;;;;
Medina, Angel; Gonzalez-Jartin, Jesus M.; Sainz, Maria J.;;;;;;;;;;;;;;;;;;;;;;;;;;;;;;;;;;;;;;;;;;;;;;;;;;;;;;;;;;;;;;;;;;;;;;;;;;;;;;;;;;;;;;;;;;;;;;;;;;;;;;;;;;;;;;;;;;;;;;;;;;;;;;
Kurbatova, A. I.; Tarko, A. M.; Kozlova, E. V.;;;;;;;;;;;;;;;;;;;;;;;;;;;;;;;;;;;;;;;;;;;;;;;;;;;;;;;;;;;;;;;;;;;;;;;;;;;;;;;;;;;;;;;;;;;;;;;;;;;;;;;;;;;;;;;;;;;;;;;;;;;;;;
Papalexiou, Simon Michael; Montanari, Alberto;;;;;;;;;;;;;;;;;;;;;;;;;;;;;;;;;;;;;;;;;;;;;;;;;;;;;;;;;;;;;;;;;;;;;;;;;;;;;;;;;;;;;;;;;;;;;;;;;;;;;;;;;;;;;;;;;;;;;;;;;;;;;;;
Bonds, Eric;;;;;;;;;;;;;;;;;;;;;;;;;;;;;;;;;;;;;;;;;;;;;;;;;;;;;;;;;;;;;;;;;;;;;;;;;;;;;;;;;;;;;;;;;;;;;;;;;;;;;;;;;;;;;;;;;;;;;;;;;;;;;;;;
Semakula, Isa; Samsuri, Suhaila;;;;;;;;;;;;;;;;;;;;;;;;;;;;;;;;;;;;;;;;;;;;;;;;;;;;;;;;;;;;;;;;;;;;;;;;;;;;;;;;;;;;;;;;;;;;;;;;;;;;;;;;;;;;;;;;;;;;;;;;;;;;;;;
Shah, Ruchita; Srivastava, Rohit;;;;;;;;;;;;;;;;;;;;;;;;;;;;;;;;;;;;;;;;;;;;;;;;;;;;;;;;;;;;;;;;;;;;;;;;;;;;;;;;;;;;;;;;;;;;;;;;;;;;;;;;;;;;;;;;;;;;;;;;;;;;;;;
Liang, Junyi; Xia, Jianyang; Liu, Lingli; Wan, Shiqiang;;;;;;;;;;;;;;;;;;;;;;;;;;;;;;;;;;;;;;;;;;;;;;;;;;;;;;;;;;;;;;;;;;;;;;;;;;;;;;;;;;;;;;;;;;;;;;;;;;;;;;;;;;;;;;;;;;;;;;;;;;;;;
Yi, Y.; Kimball, J. S.; Rawlins, M. A.; Moghaddam, M.; Euskirchen, E. S.;;;;;;;;;;;;;;;;;;;;;;;;;;;;;;;;;;;;;;;;;;;;;;;;;;;;;;;;;;;;;;;;;;;;;;;;;;;;;;;;;;;;;;;;;;;;;;;;;;;;;;;;;;;;;;;;;;;;;;;;;;;;
van der Ploeg, Frederick; Rezai, Armon;;;;;;;;;;;;;;;;;;;;;;;;;;;;;;;;;;;;;;;;;;;;;;;;;;;;;;;;;;;;;;;;;;;;;;;;;;;;;;;;;;;;;;;;;;;;;;;;;;;;;;;;;;;;;;;;;;;;;;;;;;;;;;;
Liu, Ning-Wei; Dou, You-Jun; Ma, Xiao-Gang;;;;;;;;;;;;;;;;;;;;;;;;;;;;;;;;;;;;;;;;;;;;;;;;;;;;;;;;;;;;;;;;;;;;;;;;;;;;;;;;;;;;;;;;;;;;;;;;;;;;;;;;;;;;;;;;;;;;;;;;;;;;;;
Moumen, Abdelmajid; Azizi, Ghizlane; Ben Chekroun, Kaoutar; Baghour, Mourad;;;;;;;;;;;;;;;;;;;;;;;;;;;;;;;;;;;;;;;;;;;;;;;;;;;;;;;;;;;;;;;;;;;;;;;;;;;;;;;;;;;;;;;;;;;;;;;;;;;;;;;;;;;;;;;;;;;;;;;;;;;;;
Morrison, Kyle W.; Battley, Phil F.; Sagar, Paul M.; Thompson, David R.;;;;;;;;;;;;;;;;;;;;;;;;;;;;;;;;;;;;;;;;;;;;;;;;;;;;;;;;;;;;;;;;;;;;;;;;;;;;;;;;;;;;;;;;;;;;;;;;;;;;;;;;;;;;;;;;;;;;;;;;;;;;;
Lewandowsky, Stephan; Risbey, James S.; Oreskes, Naomi;;;;;;;;;;;;;;;;;;;;;;;;;;;;;;;;;;;;;;;;;;;;;;;;;;;;;;;;;;;;;;;;;;;;;;;;;;;;;;;;;;;;;;;;;;;;;;;;;;;;;;;;;;;;;;;;;;;;;;;;;;;;;;
Wang, Xia; Yao, Yi-Feng; Wortley, Alexandra H.; Qiao, Hui-Jie; Blackmore, Stephen; Wang, Yu-Fei; Li, Cheng-Sen;;;;;;;;;;;;;;;;;;;;;;;;;;;;;;;;;;;;;;;;;;;;;;;;;;;;;;;;;;;;;;;;;;;;;;;;;;;;;;;;;;;;;;;;;;;;;;;;;;;;;;;;;;;;;;;;;;;;;;;;;;
Kwon, Tae-Sung; Li, Fengqing; Kim, Sung-Soo; Chun, Jung Hwa; Park, Young-Seuk;;;;;;;;;;;;;;;;;;;;;;;;;;;;;;;;;;;;;;;;;;;;;;;;;;;;;;;;;;;;;;;;;;;;;;;;;;;;;;;;;;;;;;;;;;;;;;;;;;;;;;;;;;;;;;;;;;;;;;;;;;;;
Jacobson, Mark Z.;;;;;;;;;;;;;;;;;;;;;;;;;;;;;;;;;;;;;;;;;;;;;;;;;;;;;;;;;;;;;;;;;;;;;;;;;;;;;;;;;;;;;;;;;;;;;;;;;;;;;;;;;;;;;;;;;;;;;;;;;;;;;;;;
Liu Ningwei; Wang Yangfeng; Ma Xiaogang; Zhang Yunhai;;;;;;;;;;;;;;;;;;;;;;;;;;;;;;;;;;;;;;;;;;;;;;;;;;;;;;;;;;;;;;;;;;;;;;;;;;;;;;;;;;;;;;;;;;;;;;;;;;;;;;;;;;;;;;;;;;;;;;;;;;;;;
Tang, She; Chen, Wenzhu; Liu, Wenzhe; Zhou, Qinyang; Zhang, Haixiang; Wang, Shaohua; Ding, Yanfeng;;;;;;;;;;;;;;;;;;;;;;;;;;;;;;;;;;;;;;;;;;;;;;;;;;;;;;;;;;;;;;;;;;;;;;;;;;;;;;;;;;;;;;;;;;;;;;;;;;;;;;;;;;;;;;;;;;;;;;;;;;
Zheng, Chengyan; Zhang, Jun; Chen, Jin; Chen, Changqing; Tian, Yunlu; Deng, Aixing; Song, Zhenwei; Nawaz, Muhammad Mohsin; van Groenigen, Kees Jan; Zhang, Weijian;;;;;;;;;;;;;;;;;;;;;;;;;;;;;;;;;;;;;;;;;;;;;;;;;;;;;;;;;;;;;;;;;;;;;;;;;;;;;;;;;;;;;;;;;;;;;;;;;;;;;;;;;;;;;;;;;;;;;;;
Thakur, Madhav P.; Del Real, Ines Martin; Cesarz, Simone; Steinauer, Katja; Reich, Peter B.; Hobbie, Sarah; Ciobanu, Marcel; Rich, Roy; Worm, Kally; Eisenhauer, Nico;;;;;;;;;;;;;;;;;;;;;;;;;;;;;;;;;;;;;;;;;;;;;;;;;;;;;;;;;;;;;;;;;;;;;;;;;;;;;;;;;;;;;;;;;;;;;;;;;;;;;;;;;;;;;;;;;;;;;;;
Guna, Ari; Zhang, Jiquan; Tong, Siqin; Bao, Yongbin; Han, Aru; Li, Kaiwei;;;;;;;;;;;;;;;;;;;;;;;;;;;;;;;;;;;;;;;;;;;;;;;;;;;;;;;;;;;;;;;;;;;;;;;;;;;;;;;;;;;;;;;;;;;;;;;;;;;;;;;;;;;;;;;;;;;;;;;;;;;
Ylmen, Peter; Mjornell, Kristina; Berlin, Johanna; Arfvidsson, Jesper;;;;;;;;;;;;;;;;;;;;;;;;;;;;;;;;;;;;;;;;;;;;;;;;;;;;;;;;;;;;;;;;;;;;;;;;;;;;;;;;;;;;;;;;;;;;;;;;;;;;;;;;;;;;;;;;;;;;;;;;;;;;;
Lwasa, Shuaib; Buyana, Kareem; Kasaija, Peter; Mutyaba, Job;;;;;;;;;;;;;;;;;;;;;;;;;;;;;;;;;;;;;;;;;;;;;;;;;;;;;;;;;;;;;;;;;;;;;;;;;;;;;;;;;;;;;;;;;;;;;;;;;;;;;;;;;;;;;;;;;;;;;;;;;;;;;
Duarte, Sofia; Cassio, Fernanda; Ferreira, Veronica; Canhoto, Cristina; Pascoal, Claudia;;;;;;;;;;;;;;;;;;;;;;;;;;;;;;;;;;;;;;;;;;;;;;;;;;;;;;;;;;;;;;;;;;;;;;;;;;;;;;;;;;;;;;;;;;;;;;;;;;;;;;;;;;;;;;;;;;;;;;;;;;;;
Meeder, John F.; Parkinson, Randall W.;;;;;;;;;;;;;;;;;;;;;;;;;;;;;;;;;;;;;;;;;;;;;;;;;;;;;;;;;;;;;;;;;;;;;;;;;;;;;;;;;;;;;;;;;;;;;;;;;;;;;;;;;;;;;;;;;;;;;;;;;;;;;;;
Fu, Yong-Bi; Peterson, Gregory W.; Horbach, Carolee; Konkin, David J.; Beiles, Avigdor; Nevo, Eviatar;;;;;;;;;;;;;;;;;;;;;;;;;;;;;;;;;;;;;;;;;;;;;;;;;;;;;;;;;;;;;;;;;;;;;;;;;;;;;;;;;;;;;;;;;;;;;;;;;;;;;;;;;;;;;;;;;;;;;;;;;;;
Todd, Alexander; Collins, Matthew; Lambert, F. Hugo; Chadwick, Robin;;;;;;;;;;;;;;;;;;;;;;;;;;;;;;;;;;;;;;;;;;;;;;;;;;;;;;;;;;;;;;;;;;;;;;;;;;;;;;;;;;;;;;;;;;;;;;;;;;;;;;;;;;;;;;;;;;;;;;;;;;;;;
Kravtsov, Sergey;;;;;;;;;;;;;;;;;;;;;;;;;;;;;;;;;;;;;;;;;;;;;;;;;;;;;;;;;;;;;;;;;;;;;;;;;;;;;;;;;;;;;;;;;;;;;;;;;;;;;;;;;;;;;;;;;;;;;;;;;;;;;;;;
Vellekoop, Johan; Woelders, Lineke; Sluijs, Appy; Miller, Kenneth G.; Speijer, Robert P.;;;;;;;;;;;;;;;;;;;;;;;;;;;;;;;;;;;;;;;;;;;;;;;;;;;;;;;;;;;;;;;;;;;;;;;;;;;;;;;;;;;;;;;;;;;;;;;;;;;;;;;;;;;;;;;;;;;;;;;;;;;;
Sekerci, Yadigar; Petrovskii, Sergei;;;;;;;;;;;;;;;;;;;;;;;;;;;;;;;;;;;;;;;;;;;;;;;;;;;;;;;;;;;;;;;;;;;;;;;;;;;;;;;;;;;;;;;;;;;;;;;;;;;;;;;;;;;;;;;;;;;;;;;;;;;;;;;
Siler, Nicholas; Po-Chedley, Stephen; Bretherton, Christopher S.;;;;;;;;;;;;;;;;;;;;;;;;;;;;;;;;;;;;;;;;;;;;;;;;;;;;;;;;;;;;;;;;;;;;;;;;;;;;;;;;;;;;;;;;;;;;;;;;;;;;;;;;;;;;;;;;;;;;;;;;;;;;;;
Wanigarathna, Darshika K. J. A.; Gao, Jiajian; Takanami, Tetsuo; Zhang, Qichun; Liu, Bin;;;;;;;;;;;;;;;;;;;;;;;;;;;;;;;;;;;;;;;;;;;;;;;;;;;;;;;;;;;;;;;;;;;;;;;;;;;;;;;;;;;;;;;;;;;;;;;;;;;;;;;;;;;;;;;;;;;;;;;;;;;;
Donnelly, Chantal; Greuell, Wouter; Andersson, Jafet; Gerten, Dieter; Pisacane, Giovanna; Roudier, Philippe; Ludwig, Fulco;;;;;;;;;;;;;;;;;;;;;;;;;;;;;;;;;;;;;;;;;;;;;;;;;;;;;;;;;;;;;;;;;;;;;;;;;;;;;;;;;;;;;;;;;;;;;;;;;;;;;;;;;;;;;;;;;;;;;;;;;;
deCastro, M.; Sousa, M. C.; Santos, F.; Dias, J. M.; Gomez-Gesteira, M.;;;;;;;;;;;;;;;;;;;;;;;;;;;;;;;;;;;;;;;;;;;;;;;;;;;;;;;;;;;;;;;;;;;;;;;;;;;;;;;;;;;;;;;;;;;;;;;;;;;;;;;;;;;;;;;;;;;;;;;;;;;;
Slot, Martijn; Kitajima, Kaoru;;;;;;;;;;;;;;;;;;;;;;;;;;;;;;;;;;;;;;;;;;;;;;;;;;;;;;;;;;;;;;;;;;;;;;;;;;;;;;;;;;;;;;;;;;;;;;;;;;;;;;;;;;;;;;;;;;;;;;;;;;;;;;;
Song, Yougui; Wang, Qiansuo; An, Zhisheng; Qiang, Xiaoke; Dong, Jibao; Chang, Hong; Zhang, Maosheng; Guo, Xiaohua;;;;;;;;;;;;;;;;;;;;;;;;;;;;;;;;;;;;;;;;;;;;;;;;;;;;;;;;;;;;;;;;;;;;;;;;;;;;;;;;;;;;;;;;;;;;;;;;;;;;;;;;;;;;;;;;;;;;;;;;;
Deane-Coe, Kirsten K.; Mauritz, Marguerite; Celis, Gerardo; Salmon, Verity; Crummer, Kathryn G.; Natali, Susan M.; Schuur, Edward A. G.;;;;;;;;;;;;;;;;;;;;;;;;;;;;;;;;;;;;;;;;;;;;;;;;;;;;;;;;;;;;;;;;;;;;;;;;;;;;;;;;;;;;;;;;;;;;;;;;;;;;;;;;;;;;;;;;;;;;;;;;;;
Maroon, Elizabeth A.; Kay, Jennifer E.; Karnauskas, Kristopher B.;;;;;;;;;;;;;;;;;;;;;;;;;;;;;;;;;;;;;;;;;;;;;;;;;;;;;;;;;;;;;;;;;;;;;;;;;;;;;;;;;;;;;;;;;;;;;;;;;;;;;;;;;;;;;;;;;;;;;;;;;;;;;;
Matsuki, Yoshio; Bidyuk, Petro I.;;;;;;;;;;;;;;;;;;;;;;;;;;;;;;;;;;;;;;;;;;;;;;;;;;;;;;;;;;;;;;;;;;;;;;;;;;;;;;;;;;;;;;;;;;;;;;;;;;;;;;;;;;;;;;;;;;;;;;;;;;;;;;;
Zhong, Yafang; Notaro, Michael; Vavrus, Stephen J.;;;;;;;;;;;;;;;;;;;;;;;;;;;;;;;;;;;;;;;;;;;;;;;;;;;;;;;;;;;;;;;;;;;;;;;;;;;;;;;;;;;;;;;;;;;;;;;;;;;;;;;;;;;;;;;;;;;;;;;;;;;;;;
Jiang, Lili; Wang, Shiping; Luo, Caiyun; Zhu, Xiaoxue; Kardol, Paul; Zhang, Zhenhua; Li, Yaoming; Wang, Changshun; Wang, Yanfen; Jones, Davey L.;;;;;;;;;;;;;;;;;;;;;;;;;;;;;;;;;;;;;;;;;;;;;;;;;;;;;;;;;;;;;;;;;;;;;;;;;;;;;;;;;;;;;;;;;;;;;;;;;;;;;;;;;;;;;;;;;;;;;;;
Gargava, Prashant; Rajagopalan, V.;;;;;;;;;;;;;;;;;;;;;;;;;;;;;;;;;;;;;;;;;;;;;;;;;;;;;;;;;;;;;;;;;;;;;;;;;;;;;;;;;;;;;;;;;;;;;;;;;;;;;;;;;;;;;;;;;;;;;;;;;;;;;;;
Nikkhah, Amin; Khojastehpour, Mehdi; Emadi, Bagher; Taheri-Rad, Alireza; Khorramdel, Surur;;;;;;;;;;;;;;;;;;;;;;;;;;;;;;;;;;;;;;;;;;;;;;;;;;;;;;;;;;;;;;;;;;;;;;;;;;;;;;;;;;;;;;;;;;;;;;;;;;;;;;;;;;;;;;;;;;;;;;;;;;;;
Agreda, Teresa; Agueda, Beatriz; Olano, Jose M.; Vicente-Serrano, Sergio M.; Fernandez-Toiran, Marina;;;;;;;;;;;;;;;;;;;;;;;;;;;;;;;;;;;;;;;;;;;;;;;;;;;;;;;;;;;;;;;;;;;;;;;;;;;;;;;;;;;;;;;;;;;;;;;;;;;;;;;;;;;;;;;;;;;;;;;;;;;;
Yu, Xiao-Ying; Barnett, J. Matthew; Amidan, Brett G.; Recknagle, Kurtis P.; Flaherty, Julia E.; Antonio, Ernest J.; Glissmeyer, John A.;;;;;;;;;;;;;;;;;;;;;;;;;;;;;;;;;;;;;;;;;;;;;;;;;;;;;;;;;;;;;;;;;;;;;;;;;;;;;;;;;;;;;;;;;;;;;;;;;;;;;;;;;;;;;;;;;;;;;;;;;;
De Cian, Enrica; Wing, Ian Sue;;;;;;;;;;;;;;;;;;;;;;;;;;;;;;;;;;;;;;;;;;;;;;;;;;;;;;;;;;;;;;;;;;;;;;;;;;;;;;;;;;;;;;;;;;;;;;;;;;;;;;;;;;;;;;;;;;;;;;;;;;;;;;;
Habibi Mohraz, Majid; Ghahri, Asghar; Karimi, Mehrdad; Golbabaei, Farideh;;;;;;;;;;;;;;;;;;;;;;;;;;;;;;;;;;;;;;;;;;;;;;;;;;;;;;;;;;;;;;;;;;;;;;;;;;;;;;;;;;;;;;;;;;;;;;;;;;;;;;;;;;;;;;;;;;;;;;;;;;;;;
Yan, Qing; Zhang, Zhongshi; Wang, Huijun; Jiang, Dabang;;;;;;;;;;;;;;;;;;;;;;;;;;;;;;;;;;;;;;;;;;;;;;;;;;;;;;;;;;;;;;;;;;;;;;;;;;;;;;;;;;;;;;;;;;;;;;;;;;;;;;;;;;;;;;;;;;;;;;;;;;;;;
Guetschow, Johannes; Jeffery, Mairi Louise; Schaeffer, Michiel; Hare, Bill;;;;;;;;;;;;;;;;;;;;;;;;;;;;;;;;;;;;;;;;;;;;;;;;;;;;;;;;;;;;;;;;;;;;;;;;;;;;;;;;;;;;;;;;;;;;;;;;;;;;;;;;;;;;;;;;;;;;;;;;;;;;;
Schaum, C. Elisa; Ffrench-Constant, Richard; Lowe, Chris; Olafsson, Jon S.; Padfield, Daniel; Yvon-Durocher, Gabriel;;;;;;;;;;;;;;;;;;;;;;;;;;;;;;;;;;;;;;;;;;;;;;;;;;;;;;;;;;;;;;;;;;;;;;;;;;;;;;;;;;;;;;;;;;;;;;;;;;;;;;;;;;;;;;;;;;;;;;;;;;;
Bjorkman, Anne D.; Myers-Smith, Isla H.; Elmendorf, Sarah C.; Normand, Signe; Rueger, Nadja; Beck, Pieter S. A.; Blach-Overgaard, Anne; Blok, Daan; Cornelissen, J. Hans C.; Forbes, Bruce C.; Georges, Damien; Goetz, Scott J.; Guay, Kevin C.; Henry, Gregory H. R.; HilleRisLambers, Janneke; Hollister, Robert D.; Karger, Dirk N.; Kattge, Jens; Manning, Peter; Prevey, Janet S.; Rixen, Christian; Schaepman-Strub, Gabriela; Thomas, Haydn J. D.; Vellend, Mark; Wilmking, Martin; Wipf, Sonja; Carbognani, Michele; Hermanutz, Luise; Levesque, Esther; Molau, Ulf; Petraglia, Alessandro; Soudzilovskaia, Nadejda A.; Spasojevic, Marko J.; Tomaselli, Marcello; Vowles, Tage; Alatalo, Juha M.; Alexander, Heather D.; Anadon-Rosell, Alba; Angers-Blondin, Sandra; te Beest, Mariska; Berner, Logan; Bjork, Robert G.; Buchwal, Agata; Buras, Allan; Christie, Katherine; Cooper, Elisabeth J.; Dullinger, Stefan; Elberling, Bo; Eskelinen, Anu; Frei, Esther R.; Grau, Oriol; Grogan, Paul; Hallinger, Martin; Harper, Karen A.; Heijmans, Monique M. P. D.; Hudson, James; Huelber, Karl; Iturrate-Garcia, Maitane; Iversen, Colleen M.; Jaroszynska, Francesca; Johnstone, Jill F.; Jorgensen, Rasmus Halfdan; Kaarlejarvi, Elina; Klady, Rebecca; Kuleza, Sara; Kulonen, Aino; Lamarque, Laurent J.; Lantz, Trevor; Little, Chelsea J.; Speed, James D. M.; Michelsen, Anders; Milbau, Ann; Nabe-Nielsen, Jacob; Nielsen, Sigrid Scholer; Ninot, Josep M.; Oberbauer, Steven F.; Olofsson, Johan; Onipchenko, Vladimir G.; Rumpf, Sabine B.; Semenchuk, Philipp; Shetti, Rohan; Collier, Laura Siegwart; Street, Lorna E.; Suding, Katharine N.; Tape, Ken D.; Trant, Andrew; Treier, Urs A.; Tremblay, Jean-Pierre; Tremblay, Maxime; Venn, Susanna; Weijers, Stef; Zamin, Tara; Boulanger-Lapointe, Noemie; Gould, William A.; Hik, David S.; Hofgaard, Annika; Jonsdottir, Ingibjorg S.; Jorgenson, Janet; Klein, Julia; Magnusson, Borgthor; Tweedie, Craig; Wookey, Philip A.; Bahn, Michael; Blonder, Benjamin; van Bodegom, Peter M.; Bond-Lamberty, Benjamin; Campetella, Giandiego; Cerabolini, Bruno E. L.; Chapin, F. Stuart, III; Cornwell, William K.; Craine, Joseph; Dainese, Matteo; de Vries, Franciska T.; Diaz, Sandra; Enquist, Brian J.; Green, Walton; Milla, Ruben; Niinemets, Ulo; Onoda, Yusuke; Ordonez, Jenny C.; Ozinga, Wim A.; Penuelas, Josep; Poorter, Hendrik; Poschlod, Peter; Reich, Peter B.; Sande, Brody; Schamp, Brandon; Sheremetev, Serge; Weiher, Evan
Long, Biao; Zhang, Baoqing; He, Chansheng; Shao, Rui; Tian, Wei;;;;;;;;;;;;;;;;;;;;;;;;;;;;;;;;;;;;;;;;;;;;;;;;;;;;;;;;;;;;;;;;;;;;;;;;;;;;;;;;;;;;;;;;;;;;;;;;;;;;;;;;;;;;;;;;;;;;;;;;;;;;
Bose, Himadri; Satyanarayana, Tulasi;;;;;;;;;;;;;;;;;;;;;;;;;;;;;;;;;;;;;;;;;;;;;;;;;;;;;;;;;;;;;;;;;;;;;;;;;;;;;;;;;;;;;;;;;;;;;;;;;;;;;;;;;;;;;;;;;;;;;;;;;;;;;;;
Wu, Yupeng; Liu, Tian; Peng, Qi'an; Shaaban, Muhammad; Hu, Ronggui;;;;;;;;;;;;;;;;;;;;;;;;;;;;;;;;;;;;;;;;;;;;;;;;;;;;;;;;;;;;;;;;;;;;;;;;;;;;;;;;;;;;;;;;;;;;;;;;;;;;;;;;;;;;;;;;;;;;;;;;;;;;
Jayawardena, Dileepa M.; Heckathorn, Scott A.; Bista, Deepesh R.; Mishra, Sasmita; Boldt, Jennifer K.; Krause, Charles R.;;;;;;;;;;;;;;;;;;;;;;;;;;;;;;;;;;;;;;;;;;;;;;;;;;;;;;;;;;;;;;;;;;;;;;;;;;;;;;;;;;;;;;;;;;;;;;;;;;;;;;;;;;;;;;;;;;;;;;;;;;;
Jing, Xianwen; Suzuki, Kentaroh; Michibata, Takuro;;;;;;;;;;;;;;;;;;;;;;;;;;;;;;;;;;;;;;;;;;;;;;;;;;;;;;;;;;;;;;;;;;;;;;;;;;;;;;;;;;;;;;;;;;;;;;;;;;;;;;;;;;;;;;;;;;;;;;;;;;;;;;
Mizuta, Ryo; Murata, Akihiko; Ishii, Masayoshi; Shiogama, Hideo; Hibino, Kenshi; Mori, Nobuhito; Arakawa, Osamu; Imada, Yukiko; Yoshida, Kohei; Aoyagi, Toshinori; Kawase, Hiroaki; Mori, Masato; Okada, Yasuko; Shimura, Tomoya; Nagatomo, Toshiharu; Ikeda, Mikiko; Endo, Hirokazu; Nosaka, Masaya; Arai, Miki; Takahashi, Chiharu; Tanaka, Kenji; Takemi, Tetsuya; Tachikawa, Yasuto; Temur, Khujanazarov; Kamae, Youichi; Watanabe, Masahiro; Sasaki, Hidetaka; Kitoh, Akio; Takayabu, Izuru; Nakakita, Eiichi; Kimoto, Masahide;;;;;;;;;;;;;;;;;;;;;;;;;;;;;;;;;;;;;;;;;;;;;;;;;;;;;;;;;;;;;;;;;;;;;;;;;;;;;;;;;;;;;;;;;;;;;;;;;;
Qiao, Mingfeng; Zhang, Ziliang; Li, Yuejiao; Xiao, Juan; Yin, Huajun; Yue, Bisong; Liu, Qing;;;;;;;;;;;;;;;;;;;;;;;;;;;;;;;;;;;;;;;;;;;;;;;;;;;;;;;;;;;;;;;;;;;;;;;;;;;;;;;;;;;;;;;;;;;;;;;;;;;;;;;;;;;;;;;;;;;;;;;;;;
Zhang, Chunhua; Tang, Guoyong; Sun, Yongyu;;;;;;;;;;;;;;;;;;;;;;;;;;;;;;;;;;;;;;;;;;;;;;;;;;;;;;;;;;;;;;;;;;;;;;;;;;;;;;;;;;;;;;;;;;;;;;;;;;;;;;;;;;;;;;;;;;;;;;;;;;;;;;
Saunders, Kyle L.;;;;;;;;;;;;;;;;;;;;;;;;;;;;;;;;;;;;;;;;;;;;;;;;;;;;;;;;;;;;;;;;;;;;;;;;;;;;;;;;;;;;;;;;;;;;;;;;;;;;;;;;;;;;;;;;;;;;;;;;;;;;;;;;
Descamps, Sebastien; Anker-Nilssen, Tycho; Barrett, Robert T.; Irons, David B.; Merkel, Flemming; Robertson, Gregory J.; Yoccoz, Nigel G.; Mallory, Mark L.; Montevecchi, William A.; Boertmann, David; Artukhin, Yuri; Christensen-Dalsgaard, Signe; Erikstad, Kjell-Einar; Gilchrist, H. Grant; Labansen, Aili L.; Lorentsen, Svein-Hakon; Mosbech, Anders; Olsen, Bergur; Petersen, Aevar; Rail, Jean-Francois; Renner, Heather M.; Strom, Hallvard; Systad, Geir H.; Wilhelm, Sabina I.; Zelenskaya, Larisa;;;;;;;;;;;;;;;;;;;;;;;;;;;;;;;;;;;;;;;;;;;;;;;;;;;;;;;;;;;;;;;;;;;;;;;;;;;;;;;;;;;;;;;;;;;;;;;;;;;;;;;;
Rahaman, Khan R.; Hassan, Quazi K.;;;;;;;;;;;;;;;;;;;;;;;;;;;;;;;;;;;;;;;;;;;;;;;;;;;;;;;;;;;;;;;;;;;;;;;;;;;;;;;;;;;;;;;;;;;;;;;;;;;;;;;;;;;;;;;;;;;;;;;;;;;;;;;
Garcia-Palacios, Pablo; Vandegehuchte, Martijn L.; Shaw, E. Ashley; Dam, Marie; Post, Keith H.; Ramirez, Kelly S.; Sylvain, Zachary A.; de Tomasel, Cecilia Milano; Wall, Diana H.;;;;;;;;;;;;;;;;;;;;;;;;;;;;;;;;;;;;;;;;;;;;;;;;;;;;;;;;;;;;;;;;;;;;;;;;;;;;;;;;;;;;;;;;;;;;;;;;;;;;;;;;;;;;;;;;;;;;;;;;
Ma, Shuang; Jiang, Jiang; Huang, Yuanyuan; Shi, Zheng; Wilson, Rachel M.; Ricciuto, Daniel; Sebestyen, Stephen D.; Hanson, Paul J.; Luo, Yiqi;;;;;;;;;;;;;;;;;;;;;;;;;;;;;;;;;;;;;;;;;;;;;;;;;;;;;;;;;;;;;;;;;;;;;;;;;;;;;;;;;;;;;;;;;;;;;;;;;;;;;;;;;;;;;;;;;;;;;;;;
Franzke, Christian L. E.;;;;;;;;;;;;;;;;;;;;;;;;;;;;;;;;;;;;;;;;;;;;;;;;;;;;;;;;;;;;;;;;;;;;;;;;;;;;;;;;;;;;;;;;;;;;;;;;;;;;;;;;;;;;;;;;;;;;;;;;;;;;;;;;
Vuille, Mathias; Franquist, Eric; Garreaud, Rene; Lavado Casimiro, Waldo Sven; Caceres, Bolivar;;;;;;;;;;;;;;;;;;;;;;;;;;;;;;;;;;;;;;;;;;;;;;;;;;;;;;;;;;;;;;;;;;;;;;;;;;;;;;;;;;;;;;;;;;;;;;;;;;;;;;;;;;;;;;;;;;;;;;;;;;;;
Wen, Shanshan; Wang, Yanjun; Su, Buda; Gao, Chao; Chen, Xue; Jiang, Tong; Tao, Hui; Fischer, Thomas; Wang, Guojie; Zhai, Jianqing;;;;;;;;;;;;;;;;;;;;;;;;;;;;;;;;;;;;;;;;;;;;;;;;;;;;;;;;;;;;;;;;;;;;;;;;;;;;;;;;;;;;;;;;;;;;;;;;;;;;;;;;;;;;;;;;;;;;;;;
Johnson, Gregory C.; Purkey, Sarah G.; Zilberman, Nathalie V.; Roemmich, Dean;;;;;;;;;;;;;;;;;;;;;;;;;;;;;;;;;;;;;;;;;;;;;;;;;;;;;;;;;;;;;;;;;;;;;;;;;;;;;;;;;;;;;;;;;;;;;;;;;;;;;;;;;;;;;;;;;;;;;;;;;;;;;
Guo, Xiaojun; Huang, Jianbin; Luo, Yong; Zhao, Zongci; Xu, Ying;;;;;;;;;;;;;;;;;;;;;;;;;;;;;;;;;;;;;;;;;;;;;;;;;;;;;;;;;;;;;;;;;;;;;;;;;;;;;;;;;;;;;;;;;;;;;;;;;;;;;;;;;;;;;;;;;;;;;;;;;;;;
Fiore, Arlene M.; Naik, Vaishali; Leibensperger, Eric M.;;;;;;;;;;;;;;;;;;;;;;;;;;;;;;;;;;;;;;;;;;;;;;;;;;;;;;;;;;;;;;;;;;;;;;;;;;;;;;;;;;;;;;;;;;;;;;;;;;;;;;;;;;;;;;;;;;;;;;;;;;;;;;
Boulila, Slah; Hinnov, Linda A.;;;;;;;;;;;;;;;;;;;;;;;;;;;;;;;;;;;;;;;;;;;;;;;;;;;;;;;;;;;;;;;;;;;;;;;;;;;;;;;;;;;;;;;;;;;;;;;;;;;;;;;;;;;;;;;;;;;;;;;;;;;;;;;
Yoshida, Kohei; Sugi, Masato; Mizuta, Ryo; Murakami, Hiroyuki; Ishii, Masayoshi;;;;;;;;;;;;;;;;;;;;;;;;;;;;;;;;;;;;;;;;;;;;;;;;;;;;;;;;;;;;;;;;;;;;;;;;;;;;;;;;;;;;;;;;;;;;;;;;;;;;;;;;;;;;;;;;;;;;;;;;;;;;
Yang, Yi; Tang, Jianping; Wang, Shuyu; Liu, Gang;;;;;;;;;;;;;;;;;;;;;;;;;;;;;;;;;;;;;;;;;;;;;;;;;;;;;;;;;;;;;;;;;;;;;;;;;;;;;;;;;;;;;;;;;;;;;;;;;;;;;;;;;;;;;;;;;;;;;;;;;;;;;
Qiu, Shuang; Zhou, Wen;;;;;;;;;;;;;;;;;;;;;;;;;;;;;;;;;;;;;;;;;;;;;;;;;;;;;;;;;;;;;;;;;;;;;;;;;;;;;;;;;;;;;;;;;;;;;;;;;;;;;;;;;;;;;;;;;;;;;;;;;;;;;;;
Pendergrass, Angeline G.; Lehner, Flavio; Sanderson, Benjamin M.; Xu, Yangyang;;;;;;;;;;;;;;;;;;;;;;;;;;;;;;;;;;;;;;;;;;;;;;;;;;;;;;;;;;;;;;;;;;;;;;;;;;;;;;;;;;;;;;;;;;;;;;;;;;;;;;;;;;;;;;;;;;;;;;;;;;;;;
Chen, Ji; Luo, Yiqi; Garcia-Palacios, Pablo; Cao, Junji; Dacal, Marina; Zhou, Xuhui; Li, Jianwei; Xia, Jianyang; Niu, Shuli; Yang, Huiyi; Shelton, Shelby; Guo, Wei; van Groenigen, Kees Jan;;;;;;;;;;;;;;;;;;;;;;;;;;;;;;;;;;;;;;;;;;;;;;;;;;;;;;;;;;;;;;;;;;;;;;;;;;;;;;;;;;;;;;;;;;;;;;;;;;;;;;;;;;;;;;;;;;;;
Ridley, Jeff K.; Blockley, Edward W.;;;;;;;;;;;;;;;;;;;;;;;;;;;;;;;;;;;;;;;;;;;;;;;;;;;;;;;;;;;;;;;;;;;;;;;;;;;;;;;;;;;;;;;;;;;;;;;;;;;;;;;;;;;;;;;;;;;;;;;;;;;;;;;
Rosentreter, Judith A.; Maher, Damien T.; Erler, Dirk V.; Murray, Rachel H.; Eyre, Bradley D.;;;;;;;;;;;;;;;;;;;;;;;;;;;;;;;;;;;;;;;;;;;;;;;;;;;;;;;;;;;;;;;;;;;;;;;;;;;;;;;;;;;;;;;;;;;;;;;;;;;;;;;;;;;;;;;;;;;;;;;;;;;;
Harding, K. J.; Twine, T. E.; VanLoocke, A.; Bagley, J. E.; Hill, J.;;;;;;;;;;;;;;;;;;;;;;;;;;;;;;;;;;;;;;;;;;;;;;;;;;;;;;;;;;;;;;;;;;;;;;;;;;;;;;;;;;;;;;;;;;;;;;;;;;;;;;;;;;;;;;;;;;;;;;;;;;;;
Russell, Kathleen; Van Sanford, David;;;;;;;;;;;;;;;;;;;;;;;;;;;;;;;;;;;;;;;;;;;;;;;;;;;;;;;;;;;;;;;;;;;;;;;;;;;;;;;;;;;;;;;;;;;;;;;;;;;;;;;;;;;;;;;;;;;;;;;;;;;;;;;
Smith, Nicholas G.;;;;;;;;;;;;;;;;;;;;;;;;;;;;;;;;;;;;;;;;;;;;;;;;;;;;;;;;;;;;;;;;;;;;;;;;;;;;;;;;;;;;;;;;;;;;;;;;;;;;;;;;;;;;;;;;;;;;;;;;;;;;;;;;
Zhao, Jiuwei; Zhan, Ruifen; Wang, Yuqing;;;;;;;;;;;;;;;;;;;;;;;;;;;;;;;;;;;;;;;;;;;;;;;;;;;;;;;;;;;;;;;;;;;;;;;;;;;;;;;;;;;;;;;;;;;;;;;;;;;;;;;;;;;;;;;;;;;;;;;;;;;;;;
Osborn, Timothy J.; Wallace, Craig J.; Lowe, Jason A.; Bernie, Dan;;;;;;;;;;;;;;;;;;;;;;;;;;;;;;;;;;;;;;;;;;;;;;;;;;;;;;;;;;;;;;;;;;;;;;;;;;;;;;;;;;;;;;;;;;;;;;;;;;;;;;;;;;;;;;;;;;;;;;;;;;;;;
Breckner, Miriam; Sunde, Uwe;;;;;;;;;;;;;;;;;;;;;;;;;;;;;;;;;;;;;;;;;;;;;;;;;;;;;;;;;;;;;;;;;;;;;;;;;;;;;;;;;;;;;;;;;;;;;;;;;;;;;;;;;;;;;;;;;;;;;;;;;;;;;;;
Lovsletten, Ola; Rypdal, Martin;;;;;;;;;;;;;;;;;;;;;;;;;;;;;;;;;;;;;;;;;;;;;;;;;;;;;;;;;;;;;;;;;;;;;;;;;;;;;;;;;;;;;;;;;;;;;;;;;;;;;;;;;;;;;;;;;;;;;;;;;;;;;;;
Carlos Baez, Jose; Pascual-Alayon, Pedro; Lourdes Ramos, Ma; Abascal, Francisco J.;;;;;;;;;;;;;;;;;;;;;;;;;;;;;;;;;;;;;;;;;;;;;;;;;;;;;;;;;;;;;;;;;;;;;;;;;;;;;;;;;;;;;;;;;;;;;;;;;;;;;;;;;;;;;;;;;;;;;;;;;;;;;
Liu, Fukai; Lu, Jian; Garuba, Oluwayemi A.; Huang, Yi; Leung, L. Ruby; Harrop, Bryce E.; Luo, Yiyong;;;;;;;;;;;;;;;;;;;;;;;;;;;;;;;;;;;;;;;;;;;;;;;;;;;;;;;;;;;;;;;;;;;;;;;;;;;;;;;;;;;;;;;;;;;;;;;;;;;;;;;;;;;;;;;;;;;;;;;;;;
Chen, Xianyao; Wallace, John M.; Tung, Ka-Kit;;;;;;;;;;;;;;;;;;;;;;;;;;;;;;;;;;;;;;;;;;;;;;;;;;;;;;;;;;;;;;;;;;;;;;;;;;;;;;;;;;;;;;;;;;;;;;;;;;;;;;;;;;;;;;;;;;;;;;;;;;;;;;
Kotova, D. S.; Klimenko, M., V; Klimenko, V. V.; Zakharov, V. E.; Bessarab, F. S.; Korenkov, Yu N.;;;;;;;;;;;;;;;;;;;;;;;;;;;;;;;;;;;;;;;;;;;;;;;;;;;;;;;;;;;;;;;;;;;;;;;;;;;;;;;;;;;;;;;;;;;;;;;;;;;;;;;;;;;;;;;;;;;;;;;;;;;
Gao, Cheng; Kim, Yong-Chan; Zheng, Yong; Yang, Wei; Chen, Liang; Ji, Niu-Niu; Wan, Shi-Qiang; Guo, Liang-Dong;;;;;;;;;;;;;;;;;;;;;;;;;;;;;;;;;;;;;;;;;;;;;;;;;;;;;;;;;;;;;;;;;;;;;;;;;;;;;;;;;;;;;;;;;;;;;;;;;;;;;;;;;;;;;;;;;;;;;;;;;
Campbell, David;;;;;;;;;;;;;;;;;;;;;;;;;;;;;;;;;;;;;;;;;;;;;;;;;;;;;;;;;;;;;;;;;;;;;;;;;;;;;;;;;;;;;;;;;;;;;;;;;;;;;;;;;;;;;;;;;;;;;;;;;;;;;;;;
Hwang, Yen-Ting; Xie, Shang-Ping; Deser, Clara; Kang, Sarah M.;;;;;;;;;;;;;;;;;;;;;;;;;;;;;;;;;;;;;;;;;;;;;;;;;;;;;;;;;;;;;;;;;;;;;;;;;;;;;;;;;;;;;;;;;;;;;;;;;;;;;;;;;;;;;;;;;;;;;;;;;;;;;
van der Ploeg, Frederick; de Zeeuw, Aart;;;;;;;;;;;;;;;;;;;;;;;;;;;;;;;;;;;;;;;;;;;;;;;;;;;;;;;;;;;;;;;;;;;;;;;;;;;;;;;;;;;;;;;;;;;;;;;;;;;;;;;;;;;;;;;;;;;;;;;;;;;;;;;
Kaufmann, Robert K.; Mann, Michael L.; Gopal, Sucharita; Liederman, Jackie A.; Howe, Peter D.; Pretis, Felix; Tang, Xiaojing; Gilmore, Michelle;;;;;;;;;;;;;;;;;;;;;;;;;;;;;;;;;;;;;;;;;;;;;;;;;;;;;;;;;;;;;;;;;;;;;;;;;;;;;;;;;;;;;;;;;;;;;;;;;;;;;;;;;;;;;;;;;;;;;;;;;
Rogelj, Joeri; Schaeffer, Michiel; Friedlingstein, Pierre; Gillett, Nathan P.; van Vuuren, Detlef P.; Riahi, Keywan; Allen, Myles; Knutti, Reto;;;;;;;;;;;;;;;;;;;;;;;;;;;;;;;;;;;;;;;;;;;;;;;;;;;;;;;;;;;;;;;;;;;;;;;;;;;;;;;;;;;;;;;;;;;;;;;;;;;;;;;;;;;;;;;;;;;;;;;;;
Andreadakis, Alexia;;;;;;;;;;;;;;;;;;;;;;;;;;;;;;;;;;;;;;;;;;;;;;;;;;;;;;;;;;;;;;;;;;;;;;;;;;;;;;;;;;;;;;;;;;;;;;;;;;;;;;;;;;;;;;;;;;;;;;;;;;;;;;;;
Rice, Karen E.; Montgomery, Rebecca A.; Stefanski, Artur; Rich, Roy L.; Reich, Peter B.;;;;;;;;;;;;;;;;;;;;;;;;;;;;;;;;;;;;;;;;;;;;;;;;;;;;;;;;;;;;;;;;;;;;;;;;;;;;;;;;;;;;;;;;;;;;;;;;;;;;;;;;;;;;;;;;;;;;;;;;;;;;
Levy, Ofir; Buckley, Lauren B.; Keitt, Timothy H.; Angilletta, Michael J., Jr.;;;;;;;;;;;;;;;;;;;;;;;;;;;;;;;;;;;;;;;;;;;;;;;;;;;;;;;;;;;;;;;;;;;;;;;;;;;;;;;;;;;;;;;;;;;;;;;;;;;;;;;;;;;;;;;;;;;;;;;;;;;;;
Klimenko, V. V.; Mikushina, O. V.; Tereshin, A. G.;;;;;;;;;;;;;;;;;;;;;;;;;;;;;;;;;;;;;;;;;;;;;;;;;;;;;;;;;;;;;;;;;;;;;;;;;;;;;;;;;;;;;;;;;;;;;;;;;;;;;;;;;;;;;;;;;;;;;;;;;;;;;;
Gasser, T.; Guivarch, C.; Tachiiri, K.; Jones, C. D.; Ciais, P.;;;;;;;;;;;;;;;;;;;;;;;;;;;;;;;;;;;;;;;;;;;;;;;;;;;;;;;;;;;;;;;;;;;;;;;;;;;;;;;;;;;;;;;;;;;;;;;;;;;;;;;;;;;;;;;;;;;;;;;;;;;;
DaMatta, Fabio M.; Rahn, Eric; Laderach, Peter; Ghini, Raquel; Ramalho, Jose C.;;;;;;;;;;;;;;;;;;;;;;;;;;;;;;;;;;;;;;;;;;;;;;;;;;;;;;;;;;;;;;;;;;;;;;;;;;;;;;;;;;;;;;;;;;;;;;;;;;;;;;;;;;;;;;;;;;;;;;;;;;;;
Le Bris, Karine; DeZeeuw, Jasmine; Godin, Paul J.; Strong, Kimberly;;;;;;;;;;;;;;;;;;;;;;;;;;;;;;;;;;;;;;;;;;;;;;;;;;;;;;;;;;;;;;;;;;;;;;;;;;;;;;;;;;;;;;;;;;;;;;;;;;;;;;;;;;;;;;;;;;;;;;;;;;;;;
Belolipetsky, Pavel; Bartsev, Sergey; Ivanova, Yuliya; Saltykov, Mikhail;;;;;;;;;;;;;;;;;;;;;;;;;;;;;;;;;;;;;;;;;;;;;;;;;;;;;;;;;;;;;;;;;;;;;;;;;;;;;;;;;;;;;;;;;;;;;;;;;;;;;;;;;;;;;;;;;;;;;;;;;;;;;
Volkov, Denis L.; Lee, Sang-Ki; Landerer, Felix W.; Lumpkin, Rick;;;;;;;;;;;;;;;;;;;;;;;;;;;;;;;;;;;;;;;;;;;;;;;;;;;;;;;;;;;;;;;;;;;;;;;;;;;;;;;;;;;;;;;;;;;;;;;;;;;;;;;;;;;;;;;;;;;;;;;;;;;;;
Verheyen, Julie; Stoks, Robby;;;;;;;;;;;;;;;;;;;;;;;;;;;;;;;;;;;;;;;;;;;;;;;;;;;;;;;;;;;;;;;;;;;;;;;;;;;;;;;;;;;;;;;;;;;;;;;;;;;;;;;;;;;;;;;;;;;;;;;;;;;;;;;
Guarino, Francesco; Cellura, Maurizio; Longo, Sonia; Gulotta, Teresa; Mistretta, Marina; Tumminia, Giovanni; Ferraro, Marco; Antonucci, Vincenzo;;;;;;;;;;;;;;;;;;;;;;;;;;;;;;;;;;;;;;;;;;;;;;;;;;;;;;;;;;;;;;;;;;;;;;;;;;;;;;;;;;;;;;;;;;;;;;;;;;;;;;;;;;;;;;;;;;;;;;;;;
